{
  "schema_version": "poc-quality-report-v1",
  "benchmark_id": "poc_prompt_01",
  "run_id": "poc-01-run-2026-02-17T22-40-00Z",
  "timestamp_utc": "2026-02-17T22:40:00Z",
  "max_iterations": 3,
  "iteration_count": 2,
  "objective_quality": {
    "gates_passed": true,
    "failed_quality_gates": [],
    "quality_report_paths": [
      "res://.claude/quality_reports/phase_5_2026-02-17T22-34-10Z.json",
      "res://.claude/quality_reports/phase_6_2026-02-17T22-39-51Z.json"
    ]
  },
  "hard_gates": {
    "zero_script_errors": true,
    "no_critical_warnings": true,
    "play_loop_complete": true,
    "controls_clear": true,
    "no_soft_lock": true,
    "quality_gates_passed": true
  },
  "anti_tutorial_visual_checks": {
    "named_art_direction": true,
    "palette_discipline": true,
    "silhouette_readability": true,
    "layering_depth": true,
    "feedback_clarity": true,
    "ui_theme_consistency": true,
    "no_raw_placeholder_feel": true
  },
  "scores": {
    "core_loop_fun": 4,
    "controls_game_feel": 4,
    "progression_variety": 4,
    "encounter_depth": 3,
    "visual_polish_cohesion": 4,
    "ux_onboarding_feedback": 4
  },
  "weighted_total_score": 82,
  "category_min_pass": true,
  "two_categories_at_least_four": true,
  "signature_moments": [
    "wave_3_enemy_intro_with_screen_fx",
    "final_arena_overload_visual_climax"
  ],
  "very_good_status": false,
  "verdict": "go",
  "next_actions": [
    "increase encounter density variety in final third",
    "add one more high-impact signature combat beat"
  ],
  "notes": "Playable and cohesive. Main improvement area is encounter depth."
}
